{
  "$schema": "./schemas/theme-repository-v1.schema.json",
  "schemaVersion": 1,
  "name": "Codex Skin Official Themes",
  "updatedAt": "2026-07-17T08:11:01Z",
  "themes": [
    {
      "id": "dilraba-star",
      "manifest": "themes/dilraba-star.json"
    },
    {
      "id": "enfp-pop",
      "manifest": "themes/enfp-pop.json"
    },
    {
      "id": "jackson-sage",
      "manifest": "themes/jackson-sage.json"
    },
    {
      "id": "kun-stage",
      "manifest": "themes/kun-stage.json"
    },
    {
      "id": "zhu-xudan-racing",
      "manifest": "themes/zhu-xudan-racing.json"
    }
  ]
}
